<?xml version="1.0" encoding="UTF-8" standalone="no"?>
<AdcGlDetails xmlns="http://schemas.iso.org/AdcsML/Messages/AdcGlDetails-v1"
    xmlns:xsi="http://www.w3.org/2001/XMLSchema-instance" xsi:schemaLocation="http://schemas.iso.org/AdcsML/Messages/AdcGlDetails-v1 AdcGlDetails.xsd">
    <GlDtls>
        <JrnId>0001-20090401-18-1-1-463</JrnId>
        <GlAcntNr>726</GlAcntNr>
        <EffectiveDt>2009-04-01</EffectiveDt>
        <JeLnDscr>旅費</JeLnDscr>
        <SrcCd>PCA会計９V.2-仕訳ﾃﾞｰﾀの受入</SrcCd>
        <CrDbInd>D</CrDbInd>
        <TrAmt>
            <FuncAmt>18572</FuncAmt>
            <FuncCurCd>JPY</FuncCurCd>
        </TrAmt>
        <Crea>
            <UserId>pca</UserId>
            <Dt>2009-04-19</Dt>
        </Crea>
    </GlDtls>
    <GlDtls>
        <JrnId>0001-20090401-18-1-2-463</JrnId>
        <GlAcntNr>191</GlAcntNr>
        <EffectiveDt>2009-04-01</EffectiveDt>
        <SrcCd>PCA会計９V.2-仕訳ﾃﾞｰﾀの受入</SrcCd>
        <CrDbInd>D</CrDbInd>
        <TrAmt>
            <FuncAmt>928</FuncAmt>
            <FuncCurCd>JPY</FuncCurCd>
        </TrAmt>
        <Crea>
            <UserId>pca</UserId>
            <Dt>2009-04-19</Dt>
        </Crea>
    </GlDtls>
    <GlDtls>
        <JrnId>0001-20090401-18-1-3-463</JrnId>
        <GlAcntNr>111</GlAcntNr>
        <EffectiveDt>2009-04-01</EffectiveDt>
        <JeLnDscr>旅費</JeLnDscr>
        <SrcCd>PCA会計９V.2-仕訳ﾃﾞｰﾀの受入</SrcCd>
        <CrDbInd>C</CrDbInd>
        <TrAmt>
            <FuncAmt>19500</FuncAmt>
            <FuncCurCd>JPY</FuncCurCd>
        </TrAmt>
        <Crea>
            <UserId>pca</UserId>
            <Dt>2009-04-19</Dt>
        </Crea>
    </GlDtls>
    <GlDtls>
        <JrnId>0001-20090401-246-2-1-465</JrnId>
        <GlAcntNr>726</GlAcntNr>
        <EffectiveDt>2009-04-01</EffectiveDt>
        <JeLnDscr>旅費</JeLnDscr>
        <SrcCd>PCA会計９V.2-仕訳ﾃﾞｰﾀの受入</SrcCd>
        <CrDbInd>D</CrDbInd>
        <TrAmt>
            <FuncAmt>9524</FuncAmt>
            <FuncCurCd>JPY</FuncCurCd>
        </TrAmt>
        <Crea>
            <UserId>pca</UserId>
            <Dt>2009-04-19</Dt>
        </Crea>
    </GlDtls>
    <GlDtls>
        <JrnId>0001-20090401-246-2-2-465</JrnId>
        <GlAcntNr>191</GlAcntNr>
        <EffectiveDt>2009-04-01</EffectiveDt>
        <SrcCd>PCA会計９V.2-仕訳ﾃﾞｰﾀの受入</SrcCd>
        <CrDbInd>D</CrDbInd>
        <TrAmt>
            <FuncAmt>476</FuncAmt>
            <FuncCurCd>JPY</FuncCurCd>
        </TrAmt>
        <Crea>
            <UserId>pca</UserId>
            <Dt>2009-04-19</Dt>
        </Crea>
    </GlDtls>
    <GlDtls>
        <JrnId>0001-20090401-246-2-3-465</JrnId>
        <GlAcntNr>111</GlAcntNr>
        <EffectiveDt>2009-04-01</EffectiveDt>
        <JeLnDscr>旅費</JeLnDscr>
        <SrcCd>PCA会計９V.2-仕訳ﾃﾞｰﾀの受入</SrcCd>
        <CrDbInd>C</CrDbInd>
        <TrAmt>
            <FuncAmt>10000</FuncAmt>
            <FuncCurCd>JPY</FuncCurCd>
        </TrAmt>
        <Crea>
            <UserId>pca</UserId>
            <Dt>2009-04-19</Dt>
        </Crea>
    </GlDtls>
</AdcGlDetails>
